{
  "acceptable_repairs": [
    {
      "operation": "tool_argument.constraint",
      "target_id": "fulfill.quantity"
    }
  ],
  "adjudication_note": "The request is for five seats, but s3 produces zero. Enforcing the positive-integer quantity constraint tied to the current request is the minimal repair.",
  "case_id": "v2-010",
  "decisive_invariant": "tool.quantity_is_positive_integer",
  "expected_repair_surface": {
    "operation": "tool_argument.constraint",
    "target_id": "fulfill.quantity"
  },
  "gold_critical_steps": [
    "v2-010-s3"
  ],
  "gold_failure_class": "invalid_tool_argument",
  "label_canary": "V2_GOLD_CANARY_V2_010_QUANTITY"
}
